{
  "accuracy_claims": {
    "opta_accuracy_validated": false,
    "real_football_accuracy_validated": false
  },
  "artifact_hashes": {},
  "coverage_summary": {
    "attack_direction_resolved_us": 0,
    "attack_direction_unknown_blocks_directional": true,
    "calibration_valid_us": 9000000,
    "joint_coverage_ratio": 0.8,
    "not_observed_us": 1000000,
    "owner_change_alone_is_not_completed_pass": true,
    "penalty_presence_is_not_box_touch": true,
    "playable_us": 9500000,
    "possession_or_contact_us": 8000000,
    "target_confirmed_us": 10000000
  },
  "created_at_utc": "2026-07-24T12:32:47.631043Z",
  "error_codes": [],
  "evaluation_status": "NOT_EVALUATED_NO_REVIEWED_PASSING_GROUND_TRUTH",
  "input_fingerprints": {
    "calibration": null,
    "contact_candidates": null,
    "identity": null,
    "possession_hypotheses": null,
    "projected_positions": null
  },
  "output_fingerprints": {
    "ball_progression_segments": null,
    "pass_candidates": null,
    "pass_outcomes": null,
    "reception_candidates": null,
    "target_ball_touches": null
  },
  "pass_candidate_count": 1,
  "pass_outcome_count": 1,
  "passing_policy_fingerprint": "5421bbe71b0bfeb21308baa8eaeb2636ce72c71e429a4f49646e03e7a11dd8cd",
  "progression_segment_count": 1,
  "provenance": {
    "label": "synthetic_contract_fixture",
    "no_real_passing_inference": true,
    "notes": "no_real_passing_inference",
    "stage": "11A"
  },
  "receipt_id": "pass_receipt_01",
  "reception_candidate_count": 1,
  "request_id": "pass_req_01",
  "review_count": 0,
  "run_id": "run_20260724T123246840074Z_920506e15272",
  "schema_version": 1,
  "state_counts": {
    "provisional": 5
  },
  "status": "contract_stub",
  "target_ball_touch_count": 1,
  "target_player_id": "target_player_01",
  "video_id": "video_synth_01",
  "warning_codes": []
}
